reviews,labels
"la comida hechada a perder el cuarto sucio, el aire acondicionado no servia, no es posible que se tenga tanto descuido en algo tan importante como los alimentos se tenga tanto descuido, es una pena en",0
"El hotel es cómodo y práctico. Tiene amenidades, tina, aire acondicionado. La atención en recepción fue estupenda, pues  me ayudaron a resolver un problema con mi reservación y respetaron el descuento de grupo.",1
"Cuando se atienda a un cliente en recepción, independientemente de la vestimenta, se debe de dar un trato igualitario ya que se está pagando por el servicio, en mi caso yo viaje por cuestiones laborales, pero llegue vestido de manera casual, y a lado mío llego una personal de traje, y el trato hacia mi persona fue muy indistinto al de la persona a mi lado cuando yo pague más por el servicio.",1
"La habitación olía mal y el elevador esta muy pequeño. Mis  maletas eran muchas no cabían. La alfombra de los pasillos está muy sucia. Llegue temprano no tenían mnu2 habitación aún,  y tuve que pagar el estacionamiento",0
"En lo personal nos pareció muy bien todo, el lugar está muy bien ubicado, el personal es muy amable y atento tanto en recepción como en restaurante. Los chicos tienen buenas sugerencias para conocer el lugar.  Si reservan con anticipación y en su página web sale más económico, les sugiero adquirir el desayuno. Volvemos pronto a la ciudad y espero quedarme ahí con mi familia de nuevo",1
"Justo obtienes lo que pagas, aunque en otras ciudades mas grandes eh pagado lo mismo y eh recibido menos, tiene que ver por la ciudad. Lo unico que le pongo un pero, es en el elevador, era una tortura cada que tenia que subir o bajar de la habitación-lobby porque las tarjetas nomas no funcionaban, aparte que el elevador sonaba bastante feo.  Todo lo demás fue bueno, aunque no tomamos el desayuno incluido si pudimos ver a los que si desfrutandolo y vimos la barra repleta, si comimos en el restaurant y todo bien rico y agusto. El lobby está muy X pero, y eso seria todo.",1
"La ubicación esta excelente para ir a la macro plaza, a dos cuadras de pabellon M, una cuadra del Metro. buena opción para los participantes del IRON MAN Monterrey. Deben de mejorar la calidad de los alimentos del desayuno buffet.",0
"El check in fue rápido. Buena estadía en general.  Habitaciones  sencillas, pero cómodas. Con plancha y yabla de planchar, caja de seguridad. Alberca ideal para niños. 2 elevadores solamente, muchas veces insuficientes para el flujo de personas que hay en horas pico.",1
"buena ubicacion buffet bueno la habitacion tiene un poco olor a baño, drenaje el estacionamiento con fugas de agua dan mal aspecto al checar con los encargados muestran buena actitud y servicio dando soluciones humanas y apoyo",1
"En el restaurant la atencion no fue la esperada, mi experiencia para el desayuno no fue lo que esperada, pues el mesero jamas me llevo la carta, tuve que ir por ella, se disculpo y tomo mi orden, pero mi orden nunca llego, por lo cual decidi dejar el lugar.",0
En linea me dieron un precio tutal de 6200 y al estar pagando me aumentaron el costo total a 7759.39 que porque en unas letritas azules que nunca enconte lo decia y pues ya no habia forma de encontar otro hotel pero de haber sabido no lonpago,0
"Viaje por parte de la empresa a curso de capacitación en las mismas instalaciones del hotel.  Por lo que nos resultó muy cómodo, buen servicio durante el evento. Además es importante mencionar su excelente ubicación....!",1
Buena atención por parte de sus empleados. Es necesario mejorar la limpieza en la parte del baño y señalizar o proporcionar algunas indicaciones para el uso correcto del mismo. Ampliar un poco más los canales de TV,1
"todo estuvo perfecto, sin duda regresare a hospedarme....muy amables en resepcion, habitación muy limpia y muy cómoda para descansar y que decir de la ubicación es excelente esta en el puro centro de monterrey",1
"buena ubicación, varios lugares para llegar caminando, le faltaba mantenimiento a las ventanas porque estaban rayadas. lo demás estuvo bien como la limpieza en la habitación y amabilidad de los trabajadores.",0
"Lo unico que he visto mal en el hotel las tantas veces que me he hospedado son las ventanas por fuera estan muy sucias, aun que claro que es muy comprensible ya que no a de ser nada facil limpiarlas por la altura etc ademas de que esas cosas no dependen de ustedes, si no de el clima, por todo lo demas en general excelente.",1
"todo muy bien, pero el clima nunca enfriaba, solo refrescaba y se sentía calor por las noches. Los días viernes muy lento el checkout y facturación, debería haber más personal en ese momento, las recepcionistas muy amables y atentas.",1
El bufette está muy caro y muy pobre en sabor y en variedad tienen que mejorar este aspecto bajar el precio del bufette ya que no es muy accesible y es preferible ir a otros lados que hay más variedad y mejor precio.,1
"Nos recibieron bien, aunque la habitación a la que llegamos olía bastante a húmedad. El personal de recepción fue muy amable y cordial, el botones nos ayudó a conseguir un taxi para llegar a tiempo; nos cambiamos de habitación por motivos del vuelo y en una tuvimos tina y en otra no.",0
"Mi estancia fue confortable, sin embargo la televisión no funcionaba adecuadamente; ya que se prendía y apagaba constantemente. Durante la noche tuve que desconectarla. Solicite apoyo en recepción en dos ocaciones y no mandaron a su personal de mantenimiento.",1
"El servicio estuvo genial, la cercania con todo, el precio los alimentos, solo hubo un pequeño detalle no limpiaban la habiatacion todos los dias. Pero en gral lo utilizaria sin pensarlo. 100% recomendado.",1
"Es un inmueble viejo revestido, el costo es muy alto para la calidad que ofrecen. Con ese precio hay mejores hoteles. Está a 5 cuadras de la macro plaza en zona comercial hay mucho flujo de personas y vehículos en el día. Si es tu primera vez creerás que es una zona insegura.",0
"La habitación de las recamaras es sumamente cómoda, la limpieza es sumamente impecable,  la única sugerencia que haría es que si uno llega antes de tiempo a hacer el Check In, para ingresar a la habitación, de ahí en fuera no tengo queja alguna, de hecho acabe de hacer otra reservacion.",1
"La habitación estuvo limpia en todo momento, nunca hizo falta toallas o algún servicio; el WiFi funcionaba bien. Lo mejor del hotel es la ubicación, está en el centro de la ciudad y muy cerca de la Macroplaza, Santa Lucía y del metro. Lo malo de la habitación, era que el ruido de la habitación de a un lado se escuchaba un poco. El desayuno del hotel no es lo mejor, todos los días era el mismo menú y una que otra comida estaba muy seca.",1
"En verdad mi estancia en este hotel fue muy buena me gusta el confort de las camas, la atención en receptación es excelente son unas señoritas muy amables y dan un un trato muy bien. Yo en verdad lo recomendaría ampliamente por que está en un bien lugar donde quedan otros centros comerciales muy cerca d ahi.",1
Pésimo servicio de las recepcionistas y de los meseros en el restaurante. Tuve que esperar muchísimo para poder hacer uso de mi habitación porque no avisan las condiciones antes. Además el elevador tarda muchisimo y solo hay hielo en un solo piso.  Las habitaciones y pasillos tienen un olor medio raro y la secadora del baño no servía. Si llamas a recepción todo el tiempo está ocupado.,0
muy bueno en todos los sentidos limpieza atención ubicación el personal muy atento muy buena atención lo recomendaría sin duda alguna esperando volver muy pronto a sus instalaciones espero mi opinion sirva de ayuda gracias,1
Me parece que pueden mejorar. No hubo toalla de manos.  El primer dia no hubo toalla para el piso (salir de la regadera).  No dejaron NI una botella de agua de cortesía. No funcionó nunca el extractor de aire del baño. No hubo una bolsa para lavandería (que normalmente usamos para la ropa sucia).,1
"un muy buen hotel,economico y con muy buena comida,lo recomiendo ampliamente y seguro que cuando regrese a monterrey me volvere a hospedar en el hotel. felicidades a IStay por su gran servicio. saludos",1
"La atención al hacer checo un fue pedante, parece que te estuvieran haciendo un favor, el cuarto estaba sucio, la alfombra sucia con manchas, la tina tenía residuos del huésped anterior, pedí servicio a cuartos y jamás recogieron la charola, los alimentos que pedí estaban fríos y no era del día. Al salir me atendió otra persona igual de pedante, cuando pedí una factura en linel me dijeron que mis datos de estaban mal y jamás me la enviaron aparte que la chica de la linea telefonica que me atendio igual de pedante. No volvería a ese hotel",0
"Muy mala atención en el Check-in que además es hasta las 15:00 horas en todos lados es a las 13:00, horas, después de la espera no hay habitaciones disponibles y esperar 1 hora más, las chapas electrónica están mal y bajar dos veces mas a que se configure la tarjeta por que no se puede acceder, compre un rastrillo y 35 minutos para que lo llevarán, tuve que llamar de nuevo a recepción, y no ofrecen una disculpa por el pésimo servicio al hacer el che-in, todos de mala cara, los clientes no tenemos la culpa.",0
"Buena atención, limpio, habitación cómoda, solo sugiero tener más atención con las toallas ya que el día que llegamos solo había 1 y era habitación doble, el día siguiente que limpiaron no dejaron ni una, ni la de manos siquiera, tuvimos que solicitarlas a recepción.",1
Hotel muy recomendable limpio la atención de sus trabajadores muy amable y servicial lo único que les falta es el servicio de shuttle tienen taxis pero para grupos mayores a 10 personas es mejor una vam,1
Durante mi estadia tome una ducha al termino me di cuenta que no habia toallas en toda la habitacion a lo que tuve que hablar a recepcion el telefono jamas enlazo a recepcion marcando 0 ni el boton donde decia recepcion tuve que bajar hasta recepcion para que me entregarna un par de toallas el elevador solo le caben a lo mucho 5 a 7 personas cuando la capacidad del hotel es para mas de 14 pisos todo esto fue incomodo el aire al llegar no funcionaba al cien,0
"Es la 4ta vez que nos quedamos con uds. Primera vez que nos dan un cuarto tan sucio y  hasta con bichos muertos. Mi esposo tomó fotos y las compartió con recepción, aunque nunca le dieron la oportunidad de hablar con el gerente. Recepción resolvió el problema de la mejor manera aunque se queda un mal sabor de boca. Nos gusta el hotel.",1
"nunca enviaron las facturas cuando lo prometían y tenia que esperar hasta 10 minutos para que me atendieran en recepción, al igual que en el restaurant montana había que recordarles frecuentemente que enviaran por correo las facturas",0
Cumple con lo basico para descansar; solo la cerradura de la puerta del sanitario no servia y el wifi era intermitente. El tipo de personas que se hospedan puede generar cierta desconfianza para cuando uno viaja sola. La atencion de recep ion y restaurante es muy buena!,0
"Buena ubicación, excelente comodidad de la cama, muy buena comunicación del personal. Por otra parte el restaurante no fue totalmente de nuestro agrado, la comida grasosa, también la sasón deja a deber, quizá sea el aceite.",1
"NO LO RECOMENDARIA  Lo único bueno es la ubicación. Las recepcionistas nada amables. El cuarto super básico, si estaba limpio. 2 elevadores para tantos cuartos, hicimos fila por 45 minutos para poder subir. (Llevábamos maletas por eso no usamos escaleras). Hielo solo en el piso 2. ( son 17 pisos en total) El precio caro para lo que ofrecen. . En otra ocasión que fui tenía mi reservacion pero llegue temprano les comente que tenía que ir a trabajar y me dijeron deja tus maletas y respetamos tu reservacion.   Regrese después del trabajo y resulta que le dieron mi habitación a alguien más, y no había otra disponible así que. Me tuve que ir a buscar en otro hotel a la mera hora en taxi. Muy malas experiencias con istay.",0
"En general la atención es muy buena, las habitaciones se encuentra limpias y en buen estado. El único inconveniente fue la mala señal del wifi, de ahí en fuera está recomendable, ubicado cerca de plaza comercial, restaurantes y la macroplaza.",1
"Todo muy bien, Excepto por un inconveniente en la alberca, mis hijas estaban en la alberca y unos hombres empezaron a faltarles al respeto. Deberían de poner vigilancia en la alberca para evitar este tipo de incidentes.",1
"Al llegar el personal de recepción fue amable, aunque el Check in es a las 3:00 pm, nos ofrecieron guardar nuestro equipaje hasta la hora mencionada.  Nos hospedamos en una habitación con dos camas matrimoniales, muy amplia, en general limpia. Cuenta con televisión por cable, aire acondicionado, secadora de cabello, plancha, closet, servicio de comida a la habitación y de lavandería. No tuvimos ningún problema con los servicios mencionados. En general creo que al hotel ya le hace falta renovar sus blancos. Las colchas, cobijas, alfombra, toallas, cortinas, aun son funcionales, pero ya se ven algo anticuadas, creo que todo lo demás está bien, solo en apariencia, creo que podrían modernizarse.  La ubicación del hotel es uno de los mejores puntos a su favor, está en una calle muy…",1
"La atencion es muy buena, sus habitaciones muy confortables y excelente ubicacion. Recomendado. A metros de la macro, no esta lejos, centrico, accesible al metro y restaurants . Definitivamente Regresare :)",1
Lleno el hotel no podía cambiarme de habitación el clima no funcionaba el olor en l habitación no era bueno y sábanas manchadas muy extraño que bajen su novela antes no estaba así!! Por eso no regreso,0
Simplementeel mejor con muy Buena ubicacionel Centro de todo restaurantes la macroplaza el paseo Santa luicia todo esta muy cerca everything is good the best in the Monterrey downtown taxis ubers by everywhere,1
"El hotel es bueno, pero si pueden mejorar mucho en las instalaciones. La atención por los empleados es muy buena, hacen o mejor posible con lo que tienen. El recibimiento no creo que sea con la persona indicada. no están indicados los servicios que ofrecen.",0
"Los muebles de la habitacion lucen deteriorados, la alfombra guarda humedad y mal olor, hace falta cambiar o restaurar muebles y restituír alfombras por pisos ceramicos y las recepcionistas deben sonreir, no cuesta nada una sonrisa.",0
Pésimo servicio de cuarto la de la limpieza se molestó porque le pides toallas pagué una estadía para 3 personas y había solo 2 y me dijo que problema la gente debe conformarse con solo dos así haya 4 personas las sábanas sucias y no las cambió pese a que le comenté y no quiso poner jabón nuevo porque dijo se da solo una vez y se debe cuidar... Pésimo,0
"La alfombra del cuarto estaba toda manchada , en general el mantenimiento del hotel muy malo , el olor a humedad es muy fuerte, deberían de cuidar el tema de mantenimiento , el hotel esta en buen ubicación pero la limpieza y la calidad de los cuartos es muy por debajo de los standares de otros hoteles de Monterrey",0
Nl habia rollo en el baño cuando llegamos. Se les marco pero ifual nl fueron.sol o habia dos toallas y sabian que la habitación fue cuadruple.el lavabo eata tapado y se.va el agua muy despacio. No funcionó la secadora de pelo.,0
"Hotel re modelado en el centro histórico, cerca de la Catedral del barrio antiguo, de plazas comerciales, sus recamaras en los pisos altos, dan una vista increíble al centro y a las montañas, buen hotel para llegar a descansar.",1
"La ubicación es lo mejor de todo, la habitación bien, sugiero que arreglen la antena porque los canales de televisión se veían fatal, lo peor del hotel es el sistema del elevador tienes que introducir la tarjeta para ir al piso que te corresponde, a mi me tocó en el piso 12, mis familiares en el piso 8 y otros en el piso 15, para ir a sus habitaciones lo único era usar la escalera o pasearte en el elevador hasta que te acercara a alguno de esos pisos.",0
Entregaron mi habitacion a otra persona y abrieron la puerta del cuarto en la noche!!! hable a recepcion y me dijeron que fue un error del sistema o del compa;ero encargado....NO PUDE DORMIR BIEN DESPUES DE ESO! QUE CLASE DE SEGURIDAD TIENE ESTE HOTEL!,0
"Estuve dos días , y NUNCA fueron a limpiar la habitación , llegamos el sábado después de las 3 de la tarde y aun no estaba lista nuestra habitación y nos tuvimos que esperar media hora , el desayuno pésimo , las habitaciones super chiquitas para el costo que tienen esta sobre valorado , la alberca estaba sucia en fin pésimo en general",0
"Nadie en mostrador me pudo solucionar, después de 30 minutos pude entrar a mi habitación. No tenía pilas la chapa. La ama de llaves FUÉ LA QUE SOLUCIONÓ EL PROBLEMA A LA PRIMERA. Pro suerte me la encontré en el piso después de bajar y subir por 3 ocasiones. Personal muy apático y con mal trato, desde el check in hasta el checkout",0
"De las 4 noches que estuve en el hotel hospedado solo una vez hubo agua purificada, del resto jamás me pusieron y van 3 veces que no me llega la factura esta tercera vez tendre que llamar para que la manden.",1
"no me ha llegado la facturación y se supone que la hacen el mismo día. la limpieza del baño fue mala, pues existían cabellos de estancias anteriores, recomiendo poner especial atención en ello. Los elevadores son insuficientes, se tiene que esperar mucho tiempo. Deberían incorporar al costo el poner una botella de agua y ponerla.",0
"Me gustó la habitación y que tenga plancha. lastima que no pude usar la alberca. la gringa que comí estaba un poco pellejuda tenia nervio, el cuarto que tenía estaba lleno de cabellos largos, y dudo que yo haya generado esos cabellos, limpien mejor porfa.",1
"Me hospede 5 noches en este hotel por ser céntrico y por tener convenio con la empresa donde trabajo   Hotel caro como la mayoría de los hoteles en Monterrey , tarifa con convenio $1450  La habitación es muy amplia , tiene un sillón reposar y un pequeño escritorio .   Te dejan unas manzanas y un chocolate de bienvenida.   Solo te dan 2 mini botellas de agua el primer día y ya no las renuevan ( $10 por botella extra que necesites )  La cama es muy cómoda , tiene aire acondicionado , tiene tv plana ( para mi gusto muy pequeña )  Está ubicado muy cerca del centro pero la calle en la que está es muy obscura y se ve insegura .   Es 100 % libre de tabaco , pero para nosotros los fumadores hay que salir hasta la calle en un pequeño techo que es donde se puede fumar , deberían de poner…",1
"Que mal que hayan tenido una sobreventa y no me cumplieron con mi reservacion. Todo lo demas estuvo bien, el trato, la comida la estadia me parecio perfecta, pero realmente fue una mala experiencia que no me hayan respetado la reservacion en el dia acordado.",0
"En general el servicio es bueno. Solo un dia olvidaron colocarme toallas de baño y manos. A los alimentos les falta calidad pero el servivio del personas es atento. La habitacion en genersl es comoda, el baño ya se ve un poco viejo",1
"no me gusto el precio, es demasiado elevado para lo que ofertan, la atención es pésima, los servicios malisimos, te ofertan que hay alberca y salen con que esta en reparación, no cuentan con personal que te ayude con tus maletas....",0
"Huele muy mal la alfombra, había fugas en el agua,no se hizo aseo completo,pocos canales en tv, gimnasio con aparato  de extensión de piernas roto, alberca sin agua,control de tv roto y pegado con cinta, las pilas se salian",0
Su ubicacion permite un desplazamiento dentro del centro historico sin necesidad de usar automovil. El servicio de comedor presenta opciones a la carata y buffete a precios accesibles. La atencion de su personal es excelente,1
"Si en Monterrey buscas un hotel céntrico,  práctico y económico, este es una buena opción! Cuenta con caja de seguridad, wifi y un baño limpio y sencillo. Hotel para descansar pues no está diseñado para disfrutar instalaciones!",0
"La habitación que nos tocó (a mi hija y a mí)  huele muy mal entre humedad y falta de limpieza, así como las cobijas de las dos camas que parecieran que no estaban limpias.  En el caso del restaurante muy buena la cocina.",0
"Nos encantó el servicio, calidad y sabor de su cocina, una felicitación al chef y al joven que nos atendió por las mañanas en el desayuno buffet. Las instalaciones muy bien cuidadas, solo hace falta un poco más afuera (aunque no depende de ustedes). Todo el servicio muy bien, felicidades y un agradecimiento en especial al Sr. Jaime Briones.",1
"Super recomendable siempre son nuestra primera opción al viajar, y la atención es muy reconfortante, gracias por ser parte de nuestro equipo en la Agencia Aday Tours, siempre cumpliendo nuestras expectativa Gracias!!",1
"Jamás, jamás me vuelvo a hospedar con ustedes. En cuanto llegamos, tardan en siquiera voltearte a ver o en decirte buenos días en recepción. Llegamos muy temprano y solicitamos una habitación, tardaron en decirnos que no había habitaciones disponibles y que si queríamos esperar en su lobby o en el restaurante a un lado, que por cierto su lobby deja mucho qué desear. Fuimos al restaurante y un sujeto se nos acercó a decirnos si no pensábamos consumir como si él fuera el dueño del lugar pese a que el propio hotel nos había dicho que podíamos estar ahí. Después se acercó la persona de recepción y nos dijo lo mismo. Preferimos salirnos a comer algo. El hotel es pésimo, su atención es pésima y hablan muy mal de Monterrey. Jamás regreso.",0
"Batalle mucho para realizar el pago de una segunda noche, el joven de recepcion no tiene paciencia ni se sabe explicar, las sritas muy amables ellas me ayudaron a completar el pago. Cuando llegue no servia la tarjeta de mi habitacion tuvieron que ir a repararla y tardo aprox 40min todo neste tiempo me tuvieron parada afuera de la habitacion esperando, de alli en fuera todo muy bien",0
No me regresaron un IPOD que se me olvido en la habitación y me lo hicieron perdediso. La recepcionista casi le falto decirme que yo era un estúpido. Por no darle seguimiento. Que me olvidara del IPOD.,0
"Habitación sucia, toallas sucias, sobres de condones abajo de las camas y las toallas con rastros de suciedad, además el personal de atención pesimo; 35 minutos de espera para que pudieran proporcionarnos shampoo",0
"muy buen lugar para hospedarse, buena ubicación, la cama es confortable, el baño limpio y la atención de su personal muy amable y dispuestos a apoyarte, definitivamente volvería a hospedarme aqí y lo recomiendo",1
"desde mi entrada al hotel hasta mi salida, tuve contacto con 4 prestadores de servicio (recepcionistas) solo una de esas 4 fue muy gentil, las otras personas denotaban  cansancio o falta de interés al momento de la atención",1
A los cuartos les hacks falta in refri chico para los refrigerios o un micro para calentar algo de comida pero por lo demas todo estuvo grandioso los guardias amables lis de recepcion amables tube Buena estancia,1
"Buena opción para relajarte, habitación cómoda con lo necesario, limpia y buen servicio y atención por parte del personal, buena ubicación pero algo tardado el acceso dependiendo el día y el horario ya que se encuentra en el mero centro de monterrey.",1
"El servicio es súper malo, pedí una toalla para mi habitación que nunca llego... elelevador igual el sistema está de la fregada solo puedes ir al piso donde te puedes quedar si tienes un familiar en el piso de más arriba tienes que ir por las escaleras",0
"El servicio en si es bueno, el problema que tuvimos fue del elevador de un día y que los empleados sepan exactamente como utilizar las escaleras, propongo que el bufete este todo junto ya que los jugos están en un extremo y el resto en el otro extremo del comerdor",1
"En general el hotel es bueno, las habitaciones cómodas y limpias. Mi estancia fue de dos noches. Sin duda lo recomiendo. Sólo les hace falta tener información de donde se pueden contratar recorridos turísticos para conocer la ciudad.",1
"Lo mejor de este hotel es su ubicación y la tranquilidad en los pisos altos.  En las demás áreas como atención, instalaciones, calidad y precio son áreas de mucha oportunidad.  Son demasiados pisos para tan solo 2 elevadores!",0
Muy mala atención tanto en el proceso de check in como en el check out. La habitación no estaba lista cuando llegamos y eran más de las 4pm. A la hora de la salida no sabían imprimir una factura. No todos somos mexicanos y la factura electrónica no nos sirve.,0
"El hotel me abrió las puertas desde el momento que llegue. Agua fría y caliente excelente, cama muy cómoda, le temperatura dentro dela habitación muy agradable. Ubicación perfecta. Recepcionistas muy amables, lindas personas y accesibles. Gracias",1
"El lugar es bueno, la ubicación también, costo-beneficio también. Lo único que me extraña es que no pongas agua de cortesía al huésped en habitación y mas cuando sabes que es para 2 personas.  En otros hoteles lo hacen y algo tan sencillo y económico da buena satisfacción.",1
"Hotel de buena calidad, precios accesibles, seguro y limpio. Cuenta con lo esencial para las visitas a Monterrey. Excelente ubicación ya que se encuentra en pleno centro de monterrey, así como una atención rápida y amable.",1
"Excelentes instalaciones y servicio de restaurant, delicioso. El internet está un poco lento y no había carritos para transportar el equipaje.  Deberían tener taxis propios con conductores más amables y/o atentos, dado que los que ofrecen sus servicios afuera del hotel, tienen un costo excesivo y dan el mismo trato que cualquier otro (de los verdes o amarillos), ni la puerta te abren aunque vean que tienes las manos ocupadas.",1
