reviews,labels
"buen hotel excelente ubicación cuenta con estacionamiento al publico y est. del hotel, una alberca pequeña sugiero que la amplien. muy buen sazon del restaurant. habitaciones muy limpias, recamara comoda y jabones muy naturales :)",1
"Hola buenas Tardes, la calidad del servicio fue excelente, el trato con el personal, fue amable y cortes.. En mis próximos viajes de negocios ahí regresare, porque aparte de que es un hotel nuevo, es ecónomico y confiables! Gracias!",1
"Los servicios son muy buenos, pero los alimentos tienen mucho que mejorar,  yo solo tome el desayuno, no tuve oportunidad de probar los otros alimentos.  Pero en este si deben poner mas foco Gracias por todos sus servcios",1
"Muy cómodo, céntrico y accesible. Me gustó mucho la experiencia vivida, desde la misma recepción hasta el check out. Recomiendo ampliamente para cualquier persona que se quede en el centro de Monterrey y quiera andar de pata de perro. :)",1
"Alojamiento para viajeros de negocios, buen servicio, nada espectacular pero por el precio es extremadamente bueno, su ubicación es buena, a mí me tocó una manifestación en el centro, nunca pude llegar al hotel, tarde 3 horas, está en el centro y es sencillo moverse casi a cualquier lugar",1
"Pueden mejorar las amenidades del baño por ejemplo champú con acondicionador, los jabones de baño pueden ser de mejora calidad. Revisar el aire acondicionado ya que en las noches en ocasiones llega a fallar, se apaga.",0
"Se debe de tener cuidado con la señal o intensidad del wifi, la verdad falló en varios momentos clave de mi estancia, y creo que esto daría un excelente servicio, yo regresaré por cuestiones de trabajo y me gustaría ver mejoras a mi regreso.",1
"Les falta mejorar la atención al cliente a las personas de recepción, aparte me dieron una habitación equivocada, había hecho mi reservación con bastante tiempo, en general la ubicación es muy buena, las instalcaiones también",1
"Tenia la entrada a las 3 pm y al llegar nos dijeron que el cuarto aun no estaba limpio, y ya habiamos hablado a las 11 am y nos dijeron lo mismo que aun no estaba listo y magicamente en 5 minutos la habitacion estaba lista. Entramos despues de las 3:30 pm .... La alberca nos encanto y el servicio del capitan Jesus. En general, buen servicio.",1
"La recepción fue excelente me trataron muy bien me orientaron sobre los tours en monterrey y me resolvieron mis inquietudes. pedí que me reasignaran habitación y muy amablemente lo hicieron, la estancia estuvo muy bien.",1
"Fue una estancia de una sola noche, la habitación muy cómoda, buena atención, cuando regrese a Monterrey sin duda me vuelvo a hospedar ahí, excelente relación calidad - precio. Lo recomiendo ampliamente.",1
"El hotel en si no es malo, solo que muchas zonas se ven algo descuidadas, particularmente las alfombras. Considero que renovando esos aspectos sería un muy buen hotel. El servicio en recepción fue buena, las personas que nos atendieron siempre muy amables. Otro plus es el estacionamiento.",0
"excelentes reglas muy bien en su seguridad y atención se agradece la atención, el ambiente que se respira es de tranquilidad y armonía la atención  de toda la gente que labora en este hotel es muy linda y repetuosa",1
"Excelente atención en el hotel, las instalaciones son muy hermosas.  En el restaurante hace falta más atención por parte de las meseras, probablemente falta personal. El resto excelente. Espero regresar!",1
"El hotel se encuentra muy bien ubicado en la ciudad, sus instalaciones están en muy buen estado, el estacionamiento esta muy bien y las habitaciones están en muy buenas condiciones, solo sugeriría que el lobby fuera un poco mas grande",1
"Estuve por estancia corta, es la segunda vez que me hospedo en este hotel. Es céntrico y sin problema en las habitaciones, con estacionamiento y restaurante en la planta baja, con alberca para los niños o adultos..",1
"Solo la limpieza del baño no se hace correctamente, el wc quedo sucio los tres días de mi estancia, mas sin embargo considero que es buen hotel y buena atención del personal. Recomendable a pesar del inconveniente.",1
"El hotel es muy bonito pero en la habitación que estuve al teléfono me faltaban teclas, la más importante para llamar a recepción. El baño estaba algo sucio y el servicio de la gente del comedor fue NEFASTO. Una señora de entre 30 y 40 años que recoge las mesas y sirve el café ni un buenos días ni un gracias nos ofreció a mi esposa y a su servidor. Una señora de lentes que hacia lo mismo era todo lo contrario.   ¡Saludos!",1
"Las habitaciones se supone que a las 3 de la tarde ya están listas, nosotros esperamos más tiempo después de las 3 ya que aún no estaba lista eso es importante ya que con el calor que se vive en mty y con el viaje lo que deseas es tener tu habitación lista, otra cosa que es bastante tedioso es el elevador tardamos casi 10 min esperando que llegara al piso la chica de la recepción se porto súper atenta y amable en eso si quedamos muy satisfechos",0
"Jamas me contestaron en room service, mi aire no funcionaba al 100, al momento de la llegada hubo buena atencion apesar de que estaba lleno el lobbie, tardadisimo el elevador ya que estaba llemo el hotel y mi piso era el 17",0
"Buena ubicación, sin embargo las habitaciones no están bien aisladas y se escucha lo de los cuartos contiguos. La comida del restaurante no es muy buena y cara, es mejor salir a comer en lugares cercanos.",0
"Me sacaron  i cartera de mi mochila , que deje sobre la maleta en la cama,cuando baje a la alberca una hora antes de salir del hotel. al salir me percate que no estaba, pidiendo en recepción entrar a la habitación para entrar y revisar. entre con mi hija revisamos todo el cuarto sin encontrar la cartera. mi hija comento a recepción poner demanda y dejó  numero celular por cualquier cosa. casi a la hora mi hija habló, no recepcionista, diciendo que apareció la cartera. fuimos a recogerla y bajo un señor  con una lbreta y dentro de la misma traía  escondida la cartera. le pregunte en que cama estaba la carera y me dijo que no sabía. esta gente roba operando de la siguiente forma: roban objetos de clientes que saben van a salir, lo esconden detras del cabezal de la cama, busca el…",0
"Muy buen lugar para hospedarse, sin embargo, hay una área de oportunidad en cuanto a los boletos de estacionamiento, ya que en cada salida o entrada, habría que esperar para salir o acceder, ya que los mismos no servían para nada, y las chicas de la recepción no deseaban ayudar en ello, solo te dan boletos que no sirven",1
"Muy buen hotel, buena ubicación, buena atención, con estacionamiento propio, deberán componer las cajas de seguridad que son muy necesarias, el desayuno suficiente y bueno, pero lo mejor la ubicación.",1
"Buen dia.  El hotel esta muy bueno, es la segunda vez que me hospedo aunque la primera fue mejor. Lo único que les daría como consejo es tener mejores elevadores ya que están mal programados y se usan mucho y seguido.",1
Esperamos muchísimo para recibir la habitación y tomando en cuenta que llegamos 5pm. Los elevadores no se dan abasto para 16 pisos y fallan muchísimo. No tiene el botón 10 y no para como en 2 pisos. Fatal!!!!,0
"Seguir mejorando con la actitud en recepción, ya que las dos ultimas veces que me he hospedado con uds. me han tratado no muy agradablemente. Pero en general con los demas servicios que ofrece el hotel son agradables.",1
"La ubicación del hotel es perfecta,  esta enseguida de la macroplaza y a la estación del metro, esta muy limpio,  cómodas las habitaciones y el personal muy amable,  cuando regrese a monterrey ahí me hospedare otra vez 😊",1
"Creo que el costo es un poco alto respecto a la calidad de la habitación, por 300 pesos menos consigues otros hoteles con la misma calidad, sin embargo agradezco todas las atenciones, si vale la pena.",1
"Solo un elevador funcionaba, me toco habitacion en el piso 10 y el elevador no tenia botón 10!!! Muchas personas dejando el hotel en la mañana, obvio siempre lleno... así que subir y bajar por la escalera....",0
"Excelente ubicación, atención en recepción sobresaliente. Los alimentos en el restaurante podrían mejorar, hace falta mas variedad en el menú y mejor sabor.  Las habitaciones son confortables y la limpieza es muy buena",1
"La mayoria de los alimentos son picosos, y al ir de otra parte de la republica no en todos lados se acostumbra  comer asi, seria mejor pusieran huevos o cosas mas comunes para el buffet del  alnuerzo, gracias",1
"La limpieza no es la mejor, la tina de la regadera estaba tapada y se inundaba... la relación precio-calidad es mala, por ese dinero te quedas en un hotel mejor. Solo que este esta bien ubicado para lo que fui a hacer...",0
"He estado en dos ocasiones con ustedes y me parece buen servicio, si va una de trabajo o vacaciones vale la pena, la ubicación es buena,  tal vez el entorno no es el mejor, pero se siente una segura con ustedes..",1
"Buen hotel, excelente ubicación y cerca de muchas atracciones,es facil moverse a cualquier punto de la ciudad desde el mismo. El servicio es excelente, sin duda volveria a llegar a hospedarme en mi proxima visita a Monterrey",1
no sirvio la caja fuerte y despuès de varias llamadas equivalentes a 4 horas nos avisan que no podian hacer nada no tenian llave ni tenian otra. el estractor del baño no funciono nunca y en 4 dias no fueron a verlo. el aire acondicionado tiene un corto arrojando mal olor,0
"no funcionaba el control de la tv. llegue a la 1.30 y no me liberaron la habitacion hasta las 3pm, deben considerar que normalmente uno deja las habitaciones antes de la 1pm, y la renta cubre 24 horas. por lo que es importante que si llegas antes de las 3pm cedan la habitacion, consignando que la habitacion vence a las 24 horas de la hora que la tomes.",1
"El personal de recepción no aprende lo básico que necesita saber, por ejemplo preguntar si el husped trae coche para entregarle un boleto de estacionamiento que le permita entrar y salir del hotel.  Son cerca de 17 pisos y solo hay dos elevadores, y uno se descompuso, fue un caos.  El buffet del desayuno muy limitado en comida, las meseras de mal humor y casi la mayoria del tiempo se la pasan adentro de la cocina. Debido al mal aspecto del desayuno pedi a la carta huevos al gusto, los dos platillos, para mi esposa y para mi, nos los dieron quemados.  En la comida pedi estrictamente comida sin picante y me trajeron la comida con trozos de chile. La mesera en lugar de disculparse me dijo ""pero no pican, comaselo"". El estacionamiento se lleno y me mandarin la estacionamiento…",0
"Volveré a hospedarme alli cada vez que vaya de viaje, la habitación estaba muy limpia, el servicio muy bueno, lo unico fue que al día siguiente un elevador no funcionaba y era lento el subir y bajar debido a las constantes paradas del elevador.",1
"Sugerencia, seguir por el mismo camino de atención al cliente. Para que estos cientan que llegan a su hogar principal y no piencen que son extraños, eso es lo que pienso y creo, en hora buena Felicitaciones a todo el personal de iStay Hotel.",1
"La ubicación del hoteles excelente, ya que puedes caminar alrededor y encontrar plazas comerciales y excelentes lugares. El servicio del hotel es bueno, sólo me gustaría sugerir que el edificio completo fuese area de no fumar, los costos del Buffet de almuerzos se me hizo un poco excesivo para el menú. Pero en general creo que es bueno.",1
"Tiene  bien  definido  lo  que  es  el  servicio  al  cliente,  su  Misión  y  Visión  son  muy  buenas. Muy  buena  filosofía  de  servicio  al  cliente,  realmente  los  felicito  muy  cordialmente. Muchas  gracias  por  su  amabilidad.",1
un poco alto el precio en relacion a la calidad del hotel ... aunque estuve una sola noche y no puede evaluar de una forma mas detallada la calidad de los servicios que ofrece el hotel... la luz de los pasillos es un poco baja,0
"La habitación esta excelente y todo esta super limpio, sin embargo el restaurante da mucho que desear ya que la comida esta algo insípida, le falta sabor, sinceramente no vale lo que cuesta y la atención de la mesera fue buena solo entrego mal el cambio, pero todo lo demás esta excelente",1
"Nos gustó mucho el hotel por su ubicación relativamente cerca de la Arena Monterrey, estuvimos muy a gusto, el aire acondicionado funcionó muy bien, no se oye ruido de los pasillos o de otras habitaciones. Por el restaurante ni nos paramos porque nada más ver la carta, está carísimo.",1
"excelente  atención en recepción, el hotel muy limpio la ubicación  es muy buena están cercas los centros de negocios un poco mas atención en el restauran el buffet esta sencillo. nuestra visita fue en familia y todo exelente",1
"Solo el interruptor de las luces a un lado de la cabecera estaba descompuesto y no se podían encender. Hace falta contar con planchas y burro de planchar en las habitaciones como un servicio más de hotel, esto da mas comodidad, ya que no tienes que bajar a perdirla en recepción o pedirla a tu cuarto y esperar a que la lleven.",1
"En general el hotel es muy viejo, su remodelación es de mala calidad, se encuentra en términos generales mal mantenido, y las alfombras  sucias, para dormir esta excelente y cómodo y la ubicación es muy buena.",0
"Es un hotel antiguo pero bien remodelado, cumple lo suficiente para hospedarse por negocios. El personal muy atento y la comida tiene buen sazón, jugos naturales y fruta fresca. Está clavado en mero centro.",0
"Este hotel es de buen precio, tiene buena ubicación pues queda cerca de todo aunque los alrededores son un poco feos está cerca de la macroplaza. Es de precio accesible. No tiene un gran lobby pero os habitaciones son cómodas y limpias. Está bien en general.",0
"Los baños anticuados y goteaba la llave, retractil de plancha no funcionaba, como sugerencia faltaria poner una cafetera en la habitacion, la caja fuerte deberia estar en otro lugar y no dentro del closet, me parece algo caro. De ahí en fuera, todo excelente, muy amables en recepción, cama cómoda, instalaciones cómodas.",1
"Lo mejor del hotel es su ubicación, ya sea que vayas por cuestiones laborales o para vacacionar,  Istay es altame te recomendable. La única observación que le haría, es que la alfombra de los pasillos podria estar mas limpia, pero el servicio de limpieza para las habitaciones si es muy bueno.",1
Bien en general el precio es buenísimo y las instalaciones son muy buenas también. . Además te hacen descuento si el hotel tiene convenio con la empresa donde trabajas... te atienden rápido en recepción y con calidez,1
"En general, todo estuvo bien, nada extraordinario, la calidad de los empleados de recepción es cortes, mal el servicio de Internet en la habitaciones, la comida es buena, las llaves se bloquean cada día y es un poco molesto tener que regresar a que las vuelvan activar. Si es un poco elevado el costo de la habitación.",0
la habitacion me la entregaron dos horas mas tarde de lo acordado y del horario publicado  en recepcion. La actitud y perfil del personal considero debe tener mas disponibilidad de atencion y conocimiento de desicion .   No hay coordinacion ya que el hotel estaba full .,0
"El personal del hotel es muy amable, íbamos 12 personas y cada quien hizo su pago individual con tarjeta y nunca mostraron una mala cara, como pasa a veces en restaurantes, el lobby es pequeño, el elevador no es suficiente para la cantidad de huéspedes y pisos, afortunadamente ninguno teníamos impedimentos para usar las escaleras.  El cuarto es limpio, no es un hotel nuevo por lo que algunas cosas están gastadas pero funcionan y están limpias. La ubicación es muy buena, hay donde comer y comprar cerca, el restaurante del lobby esta rico y tienen variedad de desayunos. Volvería a hospedarme aquí sin pensarlo, sobre todo por el precio.",1
"Me encantaron varias cosas y algunas otras no. Las tarjetas para entrar a la habitación fallan mucho, los baños un poco anticuados, y para la poco moderno que es (pero no feo), me parece muy caro. De ahí en fuera, todo excelente, muy amables en recepción, los de limpieza, la cama muy cómoda, la TV  suficientemente grande, instalaciones cómodas, muy bonito en general. La pasé increíble!",1
Excelente servicio ya no mencionar la ubicación que es excelente. Es la segunda vez que utilizamos sus servicios y por el trato recibido hasta ahora sin duda seguiremos llegando. Solo puedo esperar que sigan mejorando cualquier cosa que podamos pasar por alto y que pudiera resultar en mayor comodidad.,1
"La habitación que se me entrego huele bastante mal,  su aspecto interior y de los pasillos externos en pésimas condiciones, dando un aspecto desagradable, sucio y en mal estado. así mismo al llegar la persona de recepción, atendió una persona antes que su servidor y  ambos su trato fue no fue cortes incluso como si tuviera prisa, apática y no recuerdo si me saludo, no me dio la bienvenida y mucho menos me entrego los cupones de desayuno. no me di cuenta de su nombre.",0
"Mantener un control de limpieza mas estricto, muy en particular en la alberca porque el día que la utilice estaba mucho muy sucia. Tal vez una bicicleta fija en el gimnasio.  Una de mis opiniones podría ser que contaran con una cama alterna como un catre para brindar servicio a personas que como nosotros, en ocasiones viajamos 3 personas y no dormimos juntos . puesto que vamos por cuestiones de negocios.",0
"Ya tengo tres años de viajar constantemente a Monterrey.  Se nota la mejora continua y el servicio sumado a la atención, lo recomiendo al 100%. Creo que lo que podría mejorar es la variedad así como la calidad de los alimentos. Cuentan con buenas instalaciones para lograrlo. El servicio de restaurante es cordial",1
"No me gusto que llegué a mi habitación y apenas me sente en una de las camas y se cayó la pata, no pasó a mayores ya que la repararon de inmediato, los aparatos telefónicos dan mal aspecto(recomiendo cambiarlos). El olor de los equipos de clima huel a humedad, hay que darles mantenimiento, por lo demás esta bien.",1
"Excelente ubicación, muchas tiendas alrededor, fácil transportación. Excelente seguridad en sus instalaciones. Habitación limpia y confortable. Falta comunicación en recepción, no te informan sobre el funcionamiento del elevador por ejemplo, ni dónde se encuentra la alberca u otras áreas del hotel. Pero en general un hotel muy recomendable.",1
"La ubicación del hotel es buena, en el centro de la ciudad. Las instalaciones un poco deterioradas, no funcionaba bien el aire, habitación muy obscura y tampoco funcionaban las lámparas. Solo un botella   de agua de cortesía el primer día de hospedaje, después ya nada.",0
"quise trebajar en la habitacion 743, imposible.martillazos todo el tiempo. solicite que limpiaran la habitacion no lo hicieron. regrese a descansar a las 5 de la tarde no estaba hecha la limpieza de la habitacion. al dia siguiente me levante tarde y me despertaron temprano a hacer la limpieza. ¿no hay horarios de limpieza que se cumplan? me enviaron la factura con datos de RFC erroneos, llame tres veces para que me enviaran la nueva factura.",0
"1) El baño muy deteriorado. Mi sugerencia es que cambien piso, mosaicos y accesorios. 2) El pasillo con olor algo extraño, creo es la alfombra. Mi sugerencia es que la quiten. 3) La calidad de los alimentos no son buenos.",0
Fue un buen precio para el servicio que me otorgaron. La ubicación del hotel es excelente y la facilidad para recervar tambien. Sin embargo recomiendo mejorar la caidaden en la atención al cliente y la limpieza en la habitaciones.,1
"Creo que la recepción esta sucia y deberían remodelarla al igual que el restaurant ya se ven antiguos, la habitación bastante limpia y muy confortable, a seguridad en el hotel es buena, la ubicación es excelente, el servicio en general es bueno .",0
"Todo excelente. Hubo confort, mucha seguridad al momento de dejar cosas de valor en la habitación. De volver a viajar a algún lugar me hospedaría en la misma cadena de hoteles. Felicidades por su excelente servicio.",1
"el hotel cuenta con una ubicación perfecta ya que esta cerca de plazas comerciales y a unas cuadras de la macroplaza, los cuartos son limpios y agradables, me pareció un hotel accesible en el precio.La verdad lo recomiendo mucho",1
"Muy buena ubicación y excelente trato, desde el personal de recepción hasta el de limpieza. Ofrecen soluciones rápidas ante cualquier consulta, muestran opciones de lugares a visitar en la cuidad y alrededores del hotel.",1
"la habitacion que me asignaron al principio estaba mejor y mas lujosa ,que a la que posteriormente me cambiaron y supuestamente eran las remodeladas. la que pague era de lujo.ahora la ubicacion es buena  y el resto de las instalaciones y servicio igual.en gral. si lo recomiendo",1
"había días en que no me ponían jabón o shampoo y/o crema corporal, eso m molestó.  No limpiaron la mesa de trabajo, se veía escurrida de algún líquido anterior. No me dijeron que tenían alberca y que podía disfrutar de ella. Se tardaron mas de que min para registrarme e igual tiempo para facturar.",0
"Aunque me tocó una habitación con vista al nivel de piso de la cancha de tenis, la habitación era muy agradable, amplia y limpia. EL baño bastante agradable. Prácticamente no tuve interacción con las personas del servicio. Las personas de recepción si requieren un poco de más amabilidad para con los huéspedes.",1
"Se escuchaban los ruidos de la habitación contigua ya que se tenía una puerta que las compartía,era una familia con niños así que fue algo molesto escucharlos en la mañana siguiente, creo que es bueno que indiquen en recepción que tipo de habitación se tiene ya que se evitarían molestias.",0
"Buen Hotel recommendable, el precio conseguido por internet muy bueno, la hubicacion esta excelente, el trato de los empleados muy bueno, solo los espacios en el estacionamiento es muy reducido entre carro y carro",1
Se pudiera colocoar otra botella de agua y una silla amas y una mesa mas grandre para poder trabajar ya que como comente fuimos en viaje de negocios y la habitacion es doble Le sugiero dar servicio de cafeteria en la noche ya que habemos personas que no conosemos monterrey y no sabemos donde ir a cenar,1
En mi estancia pude descansar de una manera muy confortable ya que las almohadas estan muy suavecitas y tienen un tamaño ideal. Tambien el colchon proporciona mucha comodidad. Fue agradable mi estancia en iStay.,1
"UN poco complicado el estacionamiento, no sabia que había que cambiar el boleto por el prepagado, sugiero que al momento de registrarme me lo indiquen. Por lo demás muy buenas atenciones, excelente trato en la recepción.",1
"Hotel excelente con muy buenas instalaciones. Y una inmejorable ubicación, en centro histórico de Monterrey, ampliamente recomendable para estancia en viaje de placer o negocios. Cercano de muchos puntos de interés en el centro histórico y como punto neurálgico de la capital de Nuevo León, por lo que es una muy buena opción en cualquier visita a este destino, con excelente acceso a la ciudad y centro histórico o barrio antiguo.",1
"Me gustó la ubicación del hotel, muy accesible. Los precios del restaurante son algo caros y la regadera algo difícil de usar pero en general me la pasé bien. Las camas son cómodas y la programación de la televisión era buena. Las habitaciones y el baño están bien equipados.",0
"En general mi visita fue muy placentera, solo pasamos una noche mi familia y yo, mi unica recomendacion es que cuando entreguen el boleto se aseguren que los huespedes sepamos que se tiene que cambiar el boleto por uno prepagado, es muy incomodo regresar a recepción ya estando en la pluma",1
"El hotel esta super bien ubicado, cerca de muchos puntos de interes. Las habitaciones basicas pero muy comodas, en relacion con el precio esta muy bien.  Quisiera destacar el trato del personal al entregarme mi habitacion dos horas antes del horario establecido.",1
"Un poco deterioradas las instalaciones, pero para el precio está acorde. El agua de la alberca contenía demasiado cloro. Las tarjetas para abrir la habitación se desconfiguraban muy fácilmente y no daban acceso a la habitación.",1
"Personal de recepción, nada amables. No explican, no son atentos.  Nunca me pidieron identificación para confirmar que era yo, nos dieron la habitación equivocada. Y al pedir la que habíamos reservado, nos dijeron que no había habitaciones disponibles a pesar de que habíamos reservado con un mes de anticipación. También la alberca está muy pero muy clorada.",0
"Súper bien la atención y la comodidad increíble, me gusto mucho lo cómodo de la cama y las almohadas. Además se me hiso que está muy bien ubicado cerca de muchos lugares de interés. La comida también me pareció excelente",1
exelente instalaciones cada que viaje a monterrey me quedare en ese hotel 100% recomendado el mejor sitio las mejores comidas la mejor ubicacion servicio de taxis exelente muy buen lugar para ti y tu familia o para ti y tu pareja,1
"Buena opcion para hospedarse. La atencion muy buena y calida. Esta en una zona centrica donde hay comercios y la macroplaza. Estuvimos tres noches y ni una queja, la limpieza y todo.bueno la red wi fi falló pero se soluciono. Recomendable para hospedarse.",1
"El servicio en recepción y trabajadores en general es agradable y atento, el único detalle que recomiendo es que se revisen las chapas de las habitaciones, tuve problemas con la llave en repetidas ocasiones. Por lo demás agradezco el servicio y la atención!!",1
