reviews,labels
"Nos dieron la habitación 3 horas después de que llegamos a hacer el check in, la habitación estaba limpia aunque olía muy mal, la televisión no servía, no había secadora de cabello.  La ubicación es buena porque esta en el centro, aunque esto hace que no sea una zona bonita ni segura.",0
"Iba a un congreso en el cual se nos daba una tarifa especial, pero cuando llame para hacer la reservacion como cuando hice check in la recepcionista parecia no saber nada al respecto tuve que esperar al dia siguiente de mi llegada para hablar con las recepcionistas de la mañana y termine pagando una noche en tarifa normal.",1
"en dos ocasiones me e hospedado en este hotel y no hemos tenido ningún problema, las habitaciones todo muy limpio y el baño de igual manera, las camas confortables y en excelente ubicación esta muy cercas de la macroplaza!",1
"Excelente ubicación, buenas instalaciones, habitación limpia, sólo falta cafetera con café de cortesía. La comida en el restaurante no es buena, no tiene sabor. Relación precio/calidad me parece caro. He pagado menos de $800 en hoteles Marriott con desayuno buffet incluido",1
"Es un excelente hotel a buen precio, muy buen servicio y calidad de habitacones y además en muy buena ubicación, recomendado al 100%  Suelo ir varias veces a Monterrey y creó este es de los mejores hoteles que he ido y definitivamente vuelvo",1
"En general muy bueno, me hubiera gustado unos camastros alrededor de la piscina ya que las sillas son incómodas para estar. Y no tienes muchas opciones para comer o tomar cerca de la alberca. Lo mejor es que puedes caminar por los alrededores.",1
Busqué un hotel en Monterrey que me ofreciera buena ubicación a un buen precio. Encontré iStay que además del buen precio por un costo extra me dieron un desayuno buenísimo. Lo que no me gustó es que el baño luce un poco viejo pero finalmente funcional y que desde mi habitación se escuchaba el bajar y subir del elevador. En general lo recomiendo.,1
"camas muy confortables sabanas blanco resplandeciente, aroma limpio y completamente confortables, una delici meterse a la cama , el baño de 10 vendria bien una tina. en cuanto al restaurant muy poca variedad y no me pareco muy buena la comida, el trato de las meseras muy pobre. les falta actitud",0
"Está muy bonito el hotel y con muy buena relación en cuanto al costo/servicio y calidad, las habitaciones siempre se encontraron muy limpias y las camas son muy cómodas, además de el excelente servicio que brindan en la recepción",1
"Todo estuvo muy bien en cuanto al hotel, solo en el restaurante el serviciodeparte de la cajera fue muy lento y llevavamos algo de prisa, ya que nuestra conferencia comenzaba a las 8m y teniamos al taxi esperando.",1
"los elevadores los encentro insuficientes para un hotel con tantos pisos, aunado a que son muy lentos en su movilidad ojala puedan actualizar este tema para que sea mucho mejor el servicio, la comida no al pude tomar porque cerraron temprano",1
"Las instalaciones son buenas, la comida es buena, pero la atención del restaurante deja un poco que desear. Con respecto a los elevadores no se dan abasto, debería mejorar un poco la atención al cliente.",1
"En relacion a la maquina de hielo de que solo hay una, como sugerencia minimo otras dos, en relacion con el personal del hotel y calidez humana servicio y atencion al momento todo excelente y muy buena ubicacion gracias",1
Muy buena ubicación es muy confortable las habitaciones son muy cómodas y esta cerca de todo y la atención fue muy bien es muy recomendable para las personas que buscan un hotel cerca del centro y tiene un muy buen lugar de estacionamiento,1
"Todo bien, nos gustó mucho el confort de la habitación y el trato del personal. Solo algunos detalles con las toallas, parecen muy usadas, ojalá las renueven pronto. El precio es adecuado y el hotel esta bien ubicado.",0
"En general la estancia en el hotel fue buena, sin embargo, cuenta con algunas áreas de oportunidad.  La atención del personal es excelente, tanto de recepción como de limpieza, son muy amables y serviciales. Les solicitamos muchas veces y siempre fueron muy atentos.   Las instalaciones son buenas, durante nuestra estancia batallamos un poco con los elevadores (en ratos la espera era de hasta 10 minutos y algún chistosito solicitaba el elevador en cada piso por lo que el traslado era más tardado).  En cuanto a los baños, el último día tuvimos problemas con el agua que en momentos salía caliente y en momentos fría; al bajarle al baño hace un ruido muy alto.  El aire acondicionado no funciona al 100%, estaba en la temperatura mínima y no enfriaba como debería.  En cuanto al…",1
"Por la ubicación en que se encuentra facilita el acceso y cercanía a muchos establecimientos. Las habitaciones manejan un buen tamaño y condiciones generales buenas. Una buena opción para pasar el fin de semana en Monterrey, en un lugar de buen nivel y precio moderado.",1
"de maravilla todo es excelente para viajar en familia o pareja, solo el detalle de la comida le falta sabor y barra libre para poder estar en el hotel a toda hora contar con ese servicio, y no tener la necesidad de salir del hotel",1
"Esta en un lugar clave para desplazarte a través de la Ciudad, con muchos comercios a su alrededor. Las habitaciones no son tan grandes pero agradables y con lo necesario si solo lo requieres para descansar.",1
"Me agradó el hotel, está ubicado en área muy céntrica, lo que puede ambivalente; por un lado está rodeado de comercios, lo que lo hace muy pupuloso; por otro lado, esto mismo te permite estar en medio de todo Monterrey",1
"Se escucha todo de las otras habitaciones, con eso se pierde el semtido de privacidad.  En elnrestaurante la comida no tenia buena presentación y la persona de la plancha ninestaba no fue tan agradable",0
"La calidad el hotel con el precio por noche es excelente, pero deberías consultar mejor si haces una reservación en línea pues promete ser mas barato pero en mi última experiencia el precio no coincidió con lo prometido en internet.  Debo destacar lo bueno y lo malo y la verdad es que el personal es muy amistoso, el hotel es limpio, las instalaciones son buenas y su ubicación céntrica es excelente, mucha suerte viajeros!",1
"Está muy bien ubicado y el precio es bastante bueno con relación a la calidad del hotel. La macroplaza, así como otros lugares de interes, quedan caminando, la seguridad del hotel es buena y en general la atención también.",1
"En mi opinion hablando en general, las comidas, habitaciones,servicios. Fueron excelentes, nose diga el trato de las personas que trabajan ahi, las atenciones brindadas con los huespedes de las mismas.",1
las sabanas pequeñas el colchón en muy mal estado  no limpian la habitación solo tienden la cama goteras en la tina y lava manos no recogen la basura  la comida pésima jarabe con agua se tardan en atenderte estado solo el restaurante esto es increíble real mente solo puedo decir que el personal de recepción son muy cordiales yo creo que hay que ver lo de las habitaciones,0
"Excelente calidad del costo contra los servicios ofrecidos, solo un detalle, se demoraron en el aseo de la habitación, lo que me comentaron fue que estaban llenos lo cual es completamente entendible. La ubicación es excelente, cuenta con estacionamiento y restaurante",1
"El ascensor funciona con la tarjeta de tu habitación y solo sube al piso en el que estas en mi caso tenia que ver a mis amigos que estaban tres pisos más arriba y otros tres pisos más abajo, y tenia que usar las escaleras, por esa parte me parece pésimo.",0
Excelente ubicacion y servicio buenas habitaciones con la exepcion que el a/c no trabaja al 100 y no enfriaba lo suficiente. Las habitaciones necesitan mas privacidad ya que se puede escuchar todo lo de la hanitacion de enseguida.,1
"Muy recomendable...bien ubicado, con tiendas departamentales y comerciales a la mano...cerca de macroplaza, paseo Santa Lucia museos y varios atractivos turisticos.. Estancia muy placentera y familiar.",1
"excelente servicio y camas muy cómodas, así como la tina de baño, muy buena limpieza, buena ubicación y la comida es rica , me hubiera gustado estar mas tiempo hospedado ya que la experiencia fue muy buena",1
"Recomiendo el hotel al 100%, sólo hubo un detalle de espera para entrar a la habitación, pero todo lo demás excelente. La ubicación es muy buena, es céntrica, hay lugares para comer alrededor. Lugares como parque fundidora, Arena Mty y CIntermex están super cerca.",1
"Es un servicio normal, que visto en relación precio-servicio seria una buena elección. La comida tiene buena calidad. No tuve oportunidad de visitar la alberca por lo que no puedo opinar al respecto. Las almohadas y las camas son muy cómodas. La habitación es de buen tamaño y bastante aislada para poder descansar a gusto. La ubicación del hotel es bastante céntrica y caminando puedes encontrar lugares para comer, estaciones del metro y tomar taxi para los diferentes puntos donde vayas.",1
"Me gustaría atendieran en la medida de lo posible la limpieza de las habitaciones por las mañanas. En general, las opiniones de  las personas con las que viajamos son muy buenas en relación a las instalaciones y el trato recibido por el personal, les envío un cordial saludo.",1
"Súper recomendable, la cama es una delicia al igual que los alimentos!! Súper tranquilo y una excelente ubicación :) de las mejores opciones para pasar un buen rato en Monterrey..!!! Mi amiga y yo quedamos super satisfechas con nuestra estancia",1
"Con excelente ubicación y muy buena comodidad en la habitación. Reserven con tiempo su estancia, luego no alcanzan habitación. Lo siguiente es para completar los doscientos carácteres que me pide de opinión mínima.",1
"Excelente servicio y atención, calidad en todo aspecto ademas de una muy buena ubicacion, cerca de atracciones y plazas principales. La comida muy rica solo que el tiempo de entrega si es muy largo pero dentro de lo que cabe todo muy bien",1
"Desde el primer día les pedí me mandaran la confirmación de la reservación a mi correo, a la persona encargada al parecer poco le intereso mi petición... no me lo mandó.  Cuando llegue me hicieron quedarme una noche y luego volver a bajar para hacer válida mi reservación, molestias  a quien se hospeda por sus cuestiones administrativas, cuando les avise que ya estaba ahí y podía pagar mi reservación. (llegue un día antes, pague una noche y les dije que tenía reservación para el otro día, la respuesta fue, baje mañana, en lugar de anoto lo que me está señalando no se moleste...ya estaba ahí)  Las comidas, el buffet de la mañana bien, pero las comidas que se pagaron por rentar el salón, bastante frugales, poco bien servidas y hubo una que tuve que esperar más de una hora a que la…",0
"Habitación regular cobrada como Jr suit de $800.00 anunciado en internet cobro de $1,451.00 cinismo y descaro, sin toallas, sin papel sin anuncio y atención del escritorio principal por linea de intercomunicación, son unos !!!!!!!!!!!!!!!!!!!!!!!!!!!!!!! Macroplaza es un basurero, lleno de vagos y menesterosos,",0
"Buen lugar para hospedarte aunque las condiciones de las llaves tanto en lavabo como en regadera es necesario cambiarlas, pero en términos generales muy buen lugar para descansar y muy buena ubicación",1
"El personal en todo momento fue atento, las habitaciones limpias, vista a la ciudad, Internet rápido, céntrico a 5 minutos de Macroplaza, fácil acceso, recomendable para viajes de negocios. El estacionamiento",1
"Deberían mejorar la calidad de conexión de internet. Fue un problema en toda mi estadía, adicional el teléfono directo a recepción tampoco servía y tenía que bajar desde el piso 12 a recepción a aclarar mis dudas.",0
"Mi estadía en el hotel fue tanto placentera, relajante, céntrica y económica... El restaurante interno tiene una chef que preparo los huevos rancheros más buenos que eh probado, sin mencionar ese café :O",1
"Fue la primera vez que me quede en este Hotel por cuestiones de trabajo. Desde el primer día sospeche que había elegido un mal hotel ya que al llegar a registrarme, en recepción estaban dos chicas ""sexo servidoras"" pidiendo que las dejaran subir porque alguien de una habitación las llamó. El tanque del excusado se descompuso a mi segundo día de estancia, entre 7-8 am pasaban las chicas de limpieza preguntando si podían hacer el aseo de habitación cuando a esta hora yo aun me encontraba dormida. Y mas tarde al salir de mi habitación (11am-12 del día) ya después de esa hora nadie pasaba a limpiar mi cuarto. Muy pésimo servicio, además de las habitaciones ya deterioradas, definitivamente no me quedaría nuevamente.",0
"Huele mal los pasillos, faltaban toallas y un ruido insoportable en la tuberia de agua. Mucha molestia en la habitación vecina, se oia toda la conversación, sin detalle, aclaro, pero mucho murmullo y v",1
"El baño olía horrible y l habitación tambien. Las toallas tenian manchas, las almohadas no fueron lavadas y las cobijas tampoco. Deberían poner mas atención a estos grandes detalles o ningún cliente volverá",0
"En el acceso principal –entre las palmeras- su personal de seguridad permite que los taxis se estacionen a esperar pasajeros, esto es favorable para quien va de salida y requiere de transporte, pero para aquellos que vamos de llegada en auto, -como fue mi caso- lo que represento estar detenido detrás de un vehículo -sin logotipo alguno que lo identificara como taxi- esperando a que este se moviera, ya que se encontraba justo de camino a la entrada principal del hotel –entre las palmeras-; al percatarse de la situación el encargado de seguridad me dijo que se trataba de una taxi y que ahí se estacionaba para esperar pasajeros, y que yo me hiciera de reversa y rodeara al taxista para poder llegar al acceso del hotel.  Me parece que podrían proceder como la mayoría de los hoteles,…",0
"Lo que pienso la parte de afuera falta iluminación y aunque es una vía pública deberían preocuparse por mantener al menos el frente limpio, pienso eso le daría otra imagen, por el contrario se ve sucio y peligroso.",0
"El hotel esta bien si no vas a estar todo el tiempo ahí, cuando sales al pasillo o estando en la habitación se escuchan ruidos o conversaciones de las otras habitaciones, los baños tienen fuga de agua y goteo",0
"Nuevamente de trabajo por algunos días en la cálida ciudad de Monterrey.  Cuando me preguntaron sobre el hospedaje deje que eligieran por mi.   La verdad el hotel se me hace viejo en sus instalaciones, muchísimo flujo de gente, de todo tipo (hombres, mujeres, adultos mayores, jóvenes,etc)  No me gustó que todo los ruidos de la habitación contigua de transmitieran, tampoco que el baño hiciera mucho ruido cuando se jalaba el desagüe, la regadera retenía el agua en la tina como si estuviera tapada ... claro nunca espere todo el tiempo a que fluyera totalmente, me salía y ya.  Bueno, es lo que opino.  Feliz viaje y estancia",0
"Excelente relacion precio-calidad, la habitacion a tiempo, muy buena ubicacion, me volveria a hospedar con ustedes. Y Ampliamente recomendable si buscas un hotel familiar o de negocios. Personal agradable",1
"Horrible había hasta una cucaracha hay no ! Nunca regreso , fue un viaje muy especial para mí y termino nublado por la mala experiencia del hotel ! Da mucho que desear con tan mal servicio , ni siquiera estacionamiento había",0
"Solo habia una cucaracha muerta en habitacion pero todo estubo muy bien, servicio,comfort,estaria bien agregar calentador a la alberca y agregar hielos en cada piso, en general estoy muy content con mi estadia",1
"Lo único que no me agradó fue la tina del baño al verse con mal aspecto con poco vieja y descuidada. La ubicación esta en muy buen punto. En cuanto a los taxistas de afuera disque ""guías"" no te ayudan a encontrar una dirección sino contratas su servicio de taxi.",1
"en ocasiones anteriores me he hospedado sin ningun problema, precio/calidad van de la mano,  en esta occasion hubo una situacion incomoda, el A/C no funcionaba se report y fueron a revisarlo sin exito, se report por seguna occasion hacienda la aclaracion se aseguraran la reparacion quedara al 100% y cuando llegue a media noche el A/C continuaba sin funcionar, tuvimos que quedarnos con la puerta abrierta para recibir aire del pasillo",0
"es servicio nefasto, deprimente, nunca tenia toallas en la tarde que llegaba necesitaba estar mendigando en recepción que me prestaran toallas para asearme, hasta tres veces tenia que llamar para que me hicieran el favor de prestarme toallas,  el dia de la llegada tenia 3 pañuelos faciales en el dispensador de estos y después ya no tenia nunca volvieron a colocar, mi estancia fue de 6 dias y todos los dias fue lo mismo.  nunca recomendare ese nefasto hotel, todos mis amigos, familiares, contactos de redes sociales, compañeros de todos mis trabajos ay conocieron sobre su pésimo servicio.",0
"Creo que la atención en recepción, fue pésima, el cuarto regular, los baños perdimos, herrajes viejos, taza de baño tirando agua, puerta de baño parece de escuela o carcel, el servicio de guarda equipaje se me dijo que no se hacían responsables!, la recepción no tiene servicio a habitación, la fachada del hotel sucia y descuidada, la atención por parte se seguridad fue lo único recatable",0
"excelente ubicación, excelente trato,  si volveria a quedarme en  el hotel Istay monterrey porque, la habitacion excelente, solo que los vecinos que me tocaron eran muy ruidosos pero fuera de eso todo lo demas estaba bien.",1
"Falta un poco de limpieza en las habitaciones, en específico había cabello tirado en la habitación y en el baño. En cuestión de decoración bien, al baño le haría falta una remodelación, el personal muy amable y la ubicación del hotel es excelente.",1
"En las habitaciones se escucha todo el ruido de afuera, por lo que la primera noche me costó mucho dormir, ya que el inquilino de a lado tenía música a todo volumen y no me dejaba dormir. La comida estaba desabrida y poca variedad. El elevador fallaba mucho. Creo que es un muy buen hotel, solo habría que cuidar esos detalles para que fuera excelente.",1
"Los visite al mes de junio el año anterior y olvide un dispositivo electrónico para hacer smart la tele (roku), 2 días depues llame y me dijeron que no estaba, la semana pasada me hospeda denuevo (sólo para ver si esta mi equipo) y la respuesta fui igual y dijeron que luego no aprecien las cosas. Esto hace un lugar no confiable y la respuesta de los empleados no es con empatía.",0
"Reservé en Travotel y me llevaron  istay. Seguridad despota, recepción igual, inseguridad a la entrada. En resraurant por sel del DF nos trataron mal, sobre todo la señorita que cobraba, no regreso....",0
"excelente ubicación, excelente trato, frecuentemente me quedo en el hotel Istay monterrey porque me siento segura, y además a un precio accesible considerando que se encuentra en una parte muy céntrica en la ciudad de monterrey",1
Es un hotel a mi parecer ya desgastado le falta ampliar más los salones para eventos ya que el que tiene ya se ve en deterioro las habitaciones en precio son económicos pero si de igual manera le falta una modernización   Es un hotel de 3 estrellas y los precios en comida son accesibles es ideal para gente que solo va de paseo y solo quiera ahorrar y dormir,0
"La habitación es agradable, almohadas promedio, tv. estaba estrellada y las instalaciones del baño en estado regular.  Ubicación muy buena. Es un hotel muy recomendable con sus debidos asegunes pero muy bien.",1
"Desde que conocí el servicio del hotel, su ubicación y su atención personalizada, lo elegí como punto estratégico para el desarrollo de mis actividades ya que en ocasiones es de índole familiar y otras por cuestiones de trabajo. Muchas gracias",1
"Es un buen hotel, la cama es muy buena para descanzar, solo que lo que vi que falta es tener una cafetera de ahi en fuera bien, basicamente estas en el corazon de centro historico sales y literal empieza la peatonal. Lo recomiendo, la vista a la ciudad es bonita. P.D. Recomiendo reservarlo una semana antes minimo para obtener descuento.",1
"muy buen hotel y buena comodidad y excelente ubicación lo recomiendo ampliamente sus instalaciones son excelentes, solo falta servicio de café, bonita vista de la ciudad de monterrey. la atención del personal es muy buena",1
Además que las fotos de las habitaciones no coinciden con lo que revisas en internet .. Wifislax mala señal pero buena ubicación limpieza perfecto ... No me gustó que la comunicación entre cuartos.. nos tocó. Un vecino escandaloso .. recepción todo bien. La estadía estuvo bien a pesar de que fue x cuestiones de trabajo,0
"excelente solo falta servicio de café en la habitación o cafetera , esta cercas de todo los que necesitas bonita vista a la ciudad, estacionamiento privado muy bien y la atención del personal excelente.",1
Deberían contar con centro de negocios. Servicio de café para los huéspedes. Cambien las toallas ya están viejitas y duras. Un poco más de énfasis en la limpieza. Muy bien ubicado. Por lo demás todo bien.,1
"el espacio es muy reducido, la habitación sin aire acondicionado y sin desayuno incluido, la atención del personal de recepción muy forzada, podría mejorar en los servicios ofrecidos y mas con el precio por habitación",0
"La atención muy buena, hotel con buena ubicación los servicios muy buenos en cuanto a la habitación limpia aunque ciertos detalles como es el clima o aire acondicionado muy ruidosos al encenderlo, la regadera con problema para seleccionar el tipo de salida de agua, el servicio solicitado para arreglar detalles muy lento",1
"Hice un viaje corto de dos dias, en ninguna ocasion tuve toallas en mi habitación, tuve que pedirlas en recepción ambos días. Las sabanas estaban sucias y los cojines también, en general deberían de cuidar más los detalles para hacer más placentera la estancia, restaurante con comida de cálidad baja.",0
"Está muy bien situado, cuenta con alberca y servicio de alimentos a cuartos.  Las habitaciones esta comodas y muy bien distribuidas.  El servicio en general de los empleados es muy buena y muy amable  Felicidades",1
Mi habitación estaba en mal estado y el lugar no tiene higiene. Encontré bichos en mi habitación y la gente de recepción no tuvo a bien brinda apoyo o solución de inmediato. Recomiendo que se tomen en cuenta que la limpieza es esencial para estos servicios.,0
"Muy lindas habitaciones, la cama es muy cómoda y el baño es amplio, todo muy limpio, también me gustó que esta cerca del metro Padre Mier y por lo tanto es muy accesible trasladarse, lo malo es que por la noche hay personas durmiendo en la calle cerca del hotel por lo que es mejor llegar desde el otro lado, pero aun así la zona es muy tranquila.",1
"Fue un viaje de negocios, la habitación en general estaba bien, pero tuve que solicitar que repararan la caja fuerte y cuando había que tomar un baño en la regadera salía en momentos agua fría y en momentos caliente, un día llegué temprano, como a las 3 pm y la habitación no estaba lista, según esto me dejaban una botella con agua de 600 ml. para mis tres días de estancia, creo que por el costo de la habitación no esta bien, el restaurante ofrecía un buffet muy básico y caro, la recepción, los elevadores y en general el hotel no son gran cosa. Pero felicito a la camarera que atendío mi habitación y al personal de mantenimiento que reparo la caja fuerte por su amabilidad y rapidez para atender mis peticiones.",0
Buen hotel ubicado a unas cuadras de la Macroplaza.  Se me hizo justo la relación precio - calidad. Fue para un viaje express de negocios y realmente estuve poco tiempo en el hotel.  Lo recomiendo para gente que no busca lujos.,0
"excelente servicio, disfrute mucho la estancia en el hotel .  lo que no me gusto fue que el agua de la alberca era muy fría pero lo demás excelente.  lo recomiendo ampliamente volveria a hospedarme.....",1
Este hotel es confortable limpio y se encuentra en una muy buena ubicación y es que tienes muchas cosas a tu alrededor desde comidas diversión además de que cuenta con un amplio estacionamiento y restaurante incluido té lo recomiendo,1
"Pagas poco, no puedes esperar mas...recepecion normal, no con el plus esperado, elevador bueno, n la habitacion se escuchaba el ruido de otras habitaciones, a mi gusto las camas muy incomodas, y en la reservacion decia que tenia bañera y no tenia",0
"Me da la impresión de que al reservar por Internet y obtener precios mas económicos con lleva a tener una habitación en la que siempre algo falla o de las mas austeras. No ponían amenidades, no había toallas para manos, muebles con problemas en fin",0
Fue un excelente viaje llegamos el sábado 4 aprox. a las 16:00 hs y la habitación se encontraba lista se encontraban restaurantes y tiendas de conveniencia próximas al mismo el sueño fue confortable y solo mi hija quiso ir a nadar y el agua estaba muy fría por lo demás el servicio fue excelente gracias por todo,1
"Excelente servicio, calidad y confort. con gusto volvería a hospedarme nuevamente con ustedes. las habitaciones están limpias cómodas. totalmente recomendable a un precio buen precio, espero  regresar pronto.",1
"En las habitaciones hay muebles que reflejan claramente que son viejos, tal es el caso del closet, el tocador y la funda de la silla. creo que eso demerita el que se vea 100% limpio, moderno y cómodo.",0
"Oportunidad en privacidad, todo se oye de otros cuartos, nos aventamos sesion de sexual de vecinos, cada vez que se abrian regaderas, secadora, TV, idas al baño, piso 4 cuarto 432 no fue facil dormir asi",0
